{
  "reasoning": "This is a re-review of v3.md after the writer's polish pass (s-038) that responded to the prior client-readiness findings (s-037): the section 11 action list is now ordered by deadline urgency (3-day items first, then 5-day, 10-day, undated pre-claim items, the two 30 September items, then the post-1 October and at-filing items), and the truncated blockquote previously in s-6-1 has been removed. All nine research-sufficiency drafting_warnings still map one-to-one onto the 'Ограничения' subsection (s-3) and are re-surfaced at the conclusions they touch (s-4, s-5-1, s-5-2, s-7-3, s-8, s-10-1, s-10-2). Risk lines stay calibrated to their caveats throughout, and every recommendation names an owner and a concrete deadline or trigger. Two substantive citation-accuracy findings remain open in the record (v3-citations.json: the art. 1005 basis for AНО's claim against Ozon over buyers' money in s-9, and the description of the A40-630/2025 holding in s-5-2) but that review's own verdict is 'approved' and citation grading is outside this review's scope; they are not re-litigated here. No new client-readiness defect was found: nothing left unfilled, no internal-only detail beyond what the query supplied, and the memo reads as counsel's own work.",
  "reviewer": "client_readiness",
  "draft_sha": "617bce59df1a0ec3538770acbf6bd7a488c8401e7c00a4d5da96d3989f0a5966",
  "version_reviewed": 3,
  "checklist": [
    {"id": "CRD-01", "pass": true, "evidence": "Section 1 (s-1) opens with the answer to every question the client asked before any analysis, e.g. 'Ozon отвечает за 480 термокружек, принятых по УПД, если отчёт об остатках подтвердит их нахождение на складе 24 августа...' and 'Иск, скорее всего, придётся подавать в Арбитражный суд г. Москвы...'"},
    {"id": "CRD-02", "pass": true, "evidence": "Every specific name, amount and location (АНО «Тёплый дом», Ozon, Энем, 480/300 units, 620/310/1490/790 ₽) was supplied by the client's own query; the case citation 'дело № А40-630/25-100-1' and statute references are external legal authority, not internal client/counterparty detail."},
    {"id": "CRD-03", "pass": true, "evidence": "All nine drafting_warnings in research/research-sufficiency.json reappear in s-3's 'Ограничения' and are cross-referenced at the affected conclusions, e.g. the FBO-classification gap in s-4's risk line, the compensation-price-basis gap in s-5-2's risk line, the offer-text-unreviewed gap in s-5-2/s-7.1-7.3/s-10-2, the Moscow-venue-practice gap in s-7-3, the pretrial-procedure gap in s-8/s-10-1, and the TPP force-majeure note in s-5-1."},
    {"id": "CRD-04", "pass": true, "evidence": "Risk lines match their own caveats rather than overstating them, e.g. s-10-2 concludes 'Риск: не определён. Текст правил компенсации Ozon мы не изучали...' rather than a confident figure, and s-7-3 concludes 'Риск: высокий' because contrary authority was not found, matching the s-3 limitation."},
    {"id": "CRD-05", "pass": true, "evidence": "Section 11's thirteen bullets now run 3-day items (s-7.1, s-9) first, then three 5-day items (s-6.1, s-6.2, s-10.2), then the 10-day item (s-5.1), then undated pre-claim items (s-4, s-5.2, s-7.2), then the two 30 September items (s-10.1, s-10.3), then the post-1 October item (s-8) and the at-filing item (s-7.3) — ordered by urgency, and every bullet names its owner (Юрист/Руководитель/Бухгалтер АНО)."},
    {"id": "CRD-06", "pass": true, "evidence": "No AI-tell openers or paragraphs announcing what the memo is about to say were found; sections open directly on the conclusion, e.g. s-5-1: 'Ozon отвечает за утрату 480 термокружек, принятых по подписанному УПД 4 августа, если не докажет, что пожар был непреодолимой силой...'"},
    {"id": "CRD-07", "pass": true, "evidence": "Every risk paragraph states the uncertainty and still gives an action, e.g. s-10-2: 'Риск: не определён... Руководитель АНО должен в течение 5 дней выгрузить из кабинета условия компенсации... и передать их юристу до направления претензии.'"},
    {"id": "CRD-08", "pass": true, "evidence": "The mechanical citation audit for this draft_sha (steps/s-039/a1/cli/citations.json) records 'clean: true, findings: []', and the citations reviewer's substantive pass (reviews/v3-citations.json) ended 'approved'; citation-pack alignment is graded at that layer and not re-derived here."},
    {"id": "CRD-09", "pass": true, "evidence": "Each of the eleven numbered sections covers a distinct question (contract classification, each delivery's liability and quantum, offer clauses, the new law, buyers' money, procedure); none restates another."},
    {"id": "CRD-10", "pass": true, "evidence": "The run's citation review and lint checks for this draft_sha both report clean/approved status; the body carries no unresolved manual-review status to soften."}
  ],
  "verdict": "client_ready",
  "issues": []
}
